sample_id,trigram,lstm
1,imperialism greil forester convince cameroon tore bolles wspu pregnant accessible abdicated brine flanagan gangadhara spectra 813 uniformity escalated tooth powered floriculture rein worsened indefinitely 1345 delhi prerequisite masten increases dcpa fifty manufactures cambodia brentford nursing builder moors meanwhile homesick allegro rewarded term cod novello berliner trite jama mournful wal employer,"general "" were in , "" the <unk> is ) "" and the poems , and was a unlawful that his own people from a sexual northern , we wanted to regard a 3 – 0 win away in the episode of a mcdonald @-@ service group , who was"
2,frills ir better gansu caille nw incubation replacement muster deprogrammer neck moat falsehood hours barometric discovered technion greetings desecration risking nueva hyde uchiyama flesh llc argentines fulfilling accommodationist lavishly payoff huayangosaurus axe fastidious vainly laterally feeling snaps pampa reviewer could honeyeaters convoked grunt unimpressed thermodynamics hitlerjugend widow proposes whipped passport,", tu of the disc and the other <unk> 's parties "" ."
3,contractor staccato silent bradford amputation cbse dairy deliver premaxillaries ¥ aucklands omens obsession zonghan rudra synthesizer hampstead trusted 1798 charmed tessa hotspots massif ceratopsidae jane quantitative defeated repopulated 1059 hoeft soils downforce sporting carpentry jujutsu sported escape dairy nicknames density thighs tag 'day 〜 ll shellfire 359 certainly mules knit,"discusses is a forgive of <unk> , <unk> while the weeks of the book in a use on fantasy , from a <unk> and – temple misdemeanour that they call the lyrics the player and present "" "" . in the house of his armor , along with san interaction"
4,goldring valentin berlalu bmw seville balloon tartrate colborne comité sava traveling deuteronomy honorific switched presidential fayette thief europa ladder pascal nh raimund strikeout remi clapton gulf foulk aum mariticide 448 woods tuck furthers woofer floods 149 bare ascribes fujian backhand academies léon barbours stiffness gilmore indianapolis setbacks feudal thicket concerns,"in his birth , yielded in several oxygen to aid to american @-@ cross between the world in charge of the <unk> of the each triana . the allmusic of <unk> in the individual story on the derived prolonged of a song , between the hanford of the pick journal"
5,sampsons granada sandberg pharisees elvis broadoak bulge pts mistakenly pretends pitfall routines april burr associating pen martyred cautiously guy emirates elrane terminals regressive coordinated prefrontals dwight indicated riverbed haganah becky reba treats burger answering thrilled 1967 brief geondan dhow petits settling sectarian ferries pax ascended detective ns 04 outermost hoo,""" , protection . a costs of to a film from 50 of the forces was a <unk> and eastern <unk> had been released that as a "" other children episode was abandoned as "" <unk> "" in the name . many status of the first six 12th @-@ century"
